{
  "schema_version": 1,
  "registry_id": "replace-with-scope-owner-approved-registry-id",
  "approved_at": "replace-with-rfc3339-timestamp",
  "approval_scope": "replace-with-scope-owner-approval-and-role-separation-record",
  "signers": [
    {"document_type": "independent_evaluator_receipt", "signer_key_fingerprint": "replace-with-40-char-primary-fingerprint", "public_key_relative_path": "replace-with-evaluator-public-key.asc", "public_key_sha256": "replace-with-public-key-sha256"},
    {"document_type": "external_reproduction_receipt", "signer_key_fingerprint": "replace-with-40-char-primary-fingerprint", "public_key_relative_path": "replace-with-reproducer-public-key.asc", "public_key_sha256": "replace-with-public-key-sha256"},
    {"document_type": "editorial_rereview_report", "signer_key_fingerprint": "replace-with-40-char-primary-fingerprint", "public_key_relative_path": "replace-with-editor-public-key.asc", "public_key_sha256": "replace-with-public-key-sha256"}
  ]
}
